{
  "$schema": "./capabilities.schema.json",
  "version": 3,
  "updated": "2026-08-29",
  "title": "LashPop admin owner capability contract",
  "purpose": "The release-critical list of plain-English owner jobs, including the exact outside-system or technical handoff when a safe result cannot be completed inside the admin panel alone.",
  "outsideAdmin": [
    "Vagaro owns service prices, durations, appointment availability, booking destinations, and synced stylist facts.",
    "A brand-new service requires an authenticated, full-catalog Vagaro widget refresh and reviewed website release after the owner finishes the Vagaro setup and admin sync. The admin keeps the service hidden until that technical handoff is complete.",
    "The frozen public visual system, navigation structure, and legal page structure require a reviewed code change.",
    "Work With Us benefits, pricing logic, forms, and policy rules remain system-owned; the admin owns the page introduction, path summaries, and photography."
  ],
  "capabilities": [
    {
      "id": "access-sign-in",
      "area": "Access",
      "route": "/admin/login",
      "questions": ["How do I sign in with my phone number?", "How do I sign out when I am finished?"],
      "verificationMode": "safe-live",
      "evidence": [
        { "file": "src/app/admin/login/page.tsx", "contains": ["phone", "verification"] },
        { "file": "src/components/admin-shell/AdminShell.tsx", "contains": ["Sign out"] }
      ]
    },
    {
      "id": "today-overview",
      "area": "Today",
      "route": "/admin/overview",
      "questions": ["Where do I see what needs attention today?"],
      "verificationMode": "safe-live",
      "evidence": [{ "file": "src/app/admin/(panel)/overview/page.tsx", "contains": ["Subscribers", "Sync"] }]
    },
    {
      "id": "website-performance",
      "area": "Today",
      "route": "/admin/analytics",
      "questions": ["How do I see which website traffic and booking signals need attention?"],
      "verificationMode": "safe-live",
      "evidence": [
        { "file": "src/app/admin/(panel)/analytics/page.tsx", "contains": ["Website performance", "AnalyticsBoard"] },
        { "file": "src/app/api/admin/analytics/route.ts", "contains": ["requireAdminApi", "getAdminAnalytics"] }
      ]
    },
    {
      "id": "website-overview",
      "area": "Website",
      "route": "/admin/website",
      "questions": ["Where do I see which system owns each part of the website?"],
      "verificationMode": "safe-live",
      "evidence": [{ "file": "src/app/admin/(panel)/website/page.tsx", "contains": ["Publishing ownership"] }]
    },
    {
      "id": "service-launch",
      "area": "Website",
      "route": "/admin/workflows/service-launch",
      "questions": ["How do I add or update a service in Vagaro, sync it, and know what still needs technical publication?", "How do I check that a new or updated service is ready to publish?"],
      "verificationMode": "safe-live",
      "evidence": [
        { "file": "src/app/admin/(panel)/workflows/service-launch/page.tsx", "contains": ["Launch or update a service", "launch checks ready", "VagaroFirstWorkflow"] },
        { "file": "src/lib/admin/vagaro-owner-workflows.ts", "contains": ["Settings → Service/Class Menu", "website operator", "inactive and pending"] }
      ]
    },
    {
      "id": "studio-info",
      "area": "Website",
      "route": "/admin/content/studio-info",
      "questions": ["How do I update the studio address, phone number, email, hours, booking link, map location, or social links?"],
      "verificationMode": "no-op-publish",
      "evidence": [{ "file": "src/app/admin/(panel)/content/studio-info/StudioInfoEditor.tsx", "contains": ["Phone", "Hours", "Social"] }]
    },
    {
      "id": "homepage-hero",
      "area": "Website",
      "route": "/admin/website/hero",
      "questions": ["How do I change the homepage headline or button labels?", "How do I choose the homepage hero photos and control the desktop and phone slideshow?"],
      "verificationMode": "no-op-publish",
      "evidence": [
        { "file": "src/app/admin/(panel)/website/hero/HeroContentEditor.tsx", "contains": ["Headline", "Publish"] },
        { "file": "src/app/admin/(panel)/website/hero/page.tsx", "contains": ["Desktop", "Mobile", "slideshow"] }
      ]
    },
    {
      "id": "services-booking",
      "area": "Website",
      "route": "/admin/website/services",
      "questions": ["How do I review synced services, choose service images, organize service groups, and confirm booking readiness?", "What comes from Vagaro, what can I edit in LashPop, and why can a new service stay hidden?"],
      "verificationMode": "inspect-external-owner",
      "evidence": [
        { "file": "src/app/admin/(panel)/website/services/page.tsx", "contains": ["Vagaro", "Save Changes", "Assign to subcategory", "Add or update a service"] },
        { "file": "src/lib/vagaro-booking-readiness.ts", "contains": ["static widget snapshot", "return 'pending'"] }
      ]
    },
    {
      "id": "homepage-service-cards",
      "area": "Website",
      "route": "/admin/website/homepage-services",
      "questions": ["How do I add, edit, reorder, show, or hide a service card on the homepage?"],
      "verificationMode": "no-op-publish",
      "evidence": [{ "file": "src/app/admin/(panel)/website/homepage-services/page.tsx", "contains": ["Homepage Service Cards", "Move up", "Save Changes"] }]
    },
    {
      "id": "team-stylists",
      "area": "Website",
      "route": "/admin/website/team",
      "questions": ["How do I add a new team member in Vagaro and publish them safely?", "How do I update a staff member?", "How do I sync a stylist from Vagaro?", "How do I show, hide, or reorder staff on the website?", "How do I update an external stylist's photo, bio, service tags, portfolio, quick facts, or credentials?"],
      "verificationMode": "inspect-external-owner",
      "evidence": [
        { "file": "src/app/admin/(panel)/website/team/page.tsx", "contains": ["Sync from Vagaro", "Hide from website", "Portfolio Album", "QuickFactsEditor", "CredentialsEditor", "VagaroFirstWorkflow"] },
        { "file": "src/lib/admin/vagaro-owner-workflows.ts", "contains": ["Settings → Employee Profiles → Add Employee", "Enable Online Booking", "never publishes or unpublishes"] }
      ]
    },
    {
      "id": "founder-letter",
      "area": "Website",
      "route": "/admin/content/founder-letter",
      "questions": ["How do I update the founder letter?"],
      "verificationMode": "no-op-publish",
      "evidence": [{ "file": "src/app/admin/(panel)/content/founder-letter/FounderLetterEditor.tsx", "contains": ["Paragraph", "Save"] }]
    },
    {
      "id": "founder-letter-redirect",
      "area": "Website",
      "route": "/admin/website/founder-letter",
      "questions": ["Where does the old founder-letter admin link take me?"],
      "verificationMode": "safe-live",
      "evidence": [{ "file": "src/app/admin/(panel)/website/founder-letter/page.tsx", "contains": ["redirect"] }]
    },
    {
      "id": "instagram",
      "area": "Website",
      "route": "/admin/website/instagram",
      "questions": ["How do I control how many Instagram posts appear, whether captions show, and how the carousel moves?", "How do I refresh the Instagram posts already available in the media library?"],
      "verificationMode": "no-op-publish",
      "evidence": [
        { "file": "src/app/admin/(panel)/website/instagram/page.tsx", "contains": ["Number of Posts", "Show captions", "Sync Posts"] },
        { "file": "src/components/landing-v2/sections/InstagramCarousel.tsx", "contains": ["showCaptions", "item.caption"] }
      ]
    },
    {
      "id": "faq",
      "area": "Website",
      "route": "/admin/website/faq",
      "questions": ["How do I add or change an FAQ?", "How do I organize FAQs into categories and choose which ones are visible or featured?"],
      "verificationMode": "temporary-record",
      "evidence": [{ "file": "src/app/admin/(panel)/website/faq/page.tsx", "contains": ["Add FAQ", "Featured", "Delete this FAQ"] }]
    },
    {
      "id": "quiz",
      "area": "Website",
      "route": "/admin/website/quiz",
      "questions": ["How do I add, crop, enable, or remove quiz comparison photos?", "How do I choose the photo and wording shown for each quiz result?"],
      "verificationMode": "inspect-high-impact",
      "evidence": [{ "file": "src/app/admin/(panel)/website/quiz/page.tsx", "contains": ["Manage quiz photos and result page content", "Quiz Photo Tips"] }]
    },
    {
      "id": "work-with-us",
      "area": "Website",
      "route": "/admin/website/work-with-us",
      "questions": ["How do I update the Work With Us introduction and its employee, booth, and training summaries?", "How do I add, show, hide, or remove Work With Us photos?"],
      "verificationMode": "no-op-publish",
      "evidence": [
        { "file": "src/app/admin/(panel)/website/work-with-us/WorkWithUsContentEditor.tsx", "contains": ["Page introduction", "Benefits, pricing logic, forms, and photography remain system-owned"] },
        { "file": "src/app/admin/(panel)/website/work-with-us/page.tsx", "contains": ["Add Photo", "carousel"] }
      ]
    },
    {
      "id": "search-sharing",
      "area": "Website",
      "route": "/admin/website/seo",
      "questions": ["How do I update the words and images people see in Google results and social shares?"],
      "verificationMode": "no-op-publish",
      "evidence": [{ "file": "src/app/admin/(panel)/website/seo/page.tsx", "contains": ["Meta", "OpenGraph", "Twitter"] }]
    },
    {
      "id": "reviews",
      "area": "Reviews",
      "route": "/admin/website/reviews",
      "questions": ["How do I choose and reorder the reviews shown on the homepage?", "How do I correct a review's website visibility, stylist, score, or editor notes without automation overwriting it?"],